{"$schema":"https://json-schema.org/draft/2020-12/schema","$id":"urn:opensense-documentation:schema:infrastructure-model:1.0.0","title":"OpenSenseDocumentation Canonical Infrastructure Model","description":"Deterministic canonical model used as the single technical source for documentation, diagrams, findings and business-flow rendering.","type":"object","additionalProperties":false,"required":["schemaVersion","modelId","producer","source","system","interfaces","networks","vlans","dhcp","assets","dns","aliases","gateways","routes","vpn","nat","firewallRules","services","monitoring","cronJobs","certificates","businessFlows","findings","unresolvedReferences"],"properties":{"schemaVersion":{"const":"1.0.0"},"modelId":{"$ref":"urn:opensense-documentation:schema:common:1.0.0#/$defs/stableId"},"producer":{"$ref":"urn:opensense-documentation:schema:common:1.0.0#/$defs/producer"},"source":{"$ref":"urn:opensense-documentation:schema:common:1.0.0#/$defs/sourceMetadata"},"system":{"$ref":"urn:opensense-documentation:schema:network:1.0.0#/$defs/systemRecord"},"interfaces":{"type":"array","items":{"$ref":"urn:opensense-documentation:schema:network:1.0.0#/$defs/interfaceRecord"}},"networks":{"type":"array","items":{"$ref":"urn:opensense-documentation:schema:network:1.0.0#/$defs/networkRecord"}},"vlans":{"type":"array","items":{"$ref":"urn:opensense-documentation:schema:network:1.0.0#/$defs/vlanRecord"}},"dhcp":{"$ref":"urn:opensense-documentation:schema:dhcp-assets:1.0.0#/$defs/dhcpModel"},"assets":{"type":"array","items":{"$ref":"urn:opensense-documentation:schema:dhcp-assets:1.0.0#/$defs/assetRecord"}},"dns":{"$ref":"urn:opensense-documentation:schema:operations:1.0.0#/$defs/dnsModel"},"aliases":{"type":"array","items":{"$ref":"urn:opensense-documentation:schema:network:1.0.0#/$defs/aliasRecord"}},"gateways":{"type":"array","items":{"$ref":"urn:opensense-documentation:schema:network:1.0.0#/$defs/gatewayRecord"}},"routes":{"type":"array","items":{"$ref":"urn:opensense-documentation:schema:network:1.0.0#/$defs/routeRecord"}},"vpn":{"type":"array","items":{"$ref":"urn:opensense-documentation:schema:network:1.0.0#/$defs/vpnRecord"}},"nat":{"type":"array","items":{"$ref":"urn:opensense-documentation:schema:network:1.0.0#/$defs/natRecord"}},"firewallRules":{"type":"array","items":{"$ref":"urn:opensense-documentation:schema:network:1.0.0#/$defs/firewallRuleRecord"}},"services":{"type":"array","items":{"$ref":"urn:opensense-documentation:schema:operations:1.0.0#/$defs/serviceRecord"}},"monitoring":{"type":"array","items":{"$ref":"urn:opensense-documentation:schema:operations:1.0.0#/$defs/monitoringRecord"}},"cronJobs":{"type":"array","items":{"$ref":"urn:opensense-documentation:schema:operations:1.0.0#/$defs/cronJobRecord"}},"certificates":{"type":"array","items":{"$ref":"urn:opensense-documentation:schema:operations:1.0.0#/$defs/certificateRecord"}},"businessFlows":{"type":"array","items":{"$ref":"urn:opensense-documentation:schema:operations:1.0.0#/$defs/businessFlowRecord"}},"findings":{"type":"array","items":{"$ref":"urn:opensense-documentation:schema:operations:1.0.0#/$defs/findingRecord"}},"unresolvedReferences":{"type":"array","items":{"$ref":"urn:opensense-documentation:schema:operations:1.0.0#/$defs/unresolvedReferenceRecord"}}}}
