{
  "schemaVersion": "1.0.0",
  "modelId": "model:sha256:000000000000000000000000",
  "producer": {
    "parserVersion": "0.0.0",
    "rulesetVersion": "0.0.0",
    "schemaVersion": "1.0.0",
    "idStrategyVersion": "1.0.0",
    "canonicalizationVersion": "1.0.0"
  },
  "source": {
    "sourceType": "OPNsense config.xml",
    "originalFileName": "config.xml",
    "originalSha256": "1111111111111111111111111111111111111111111111111111111111111111",
    "sanitizedFileName": "config.sanitized.xml",
    "sanitizedSha256": "0000000000000000000000000000000000000000000000000000000000000000",
    "sanitizerVersion": "1.1.0",
    "sanitizationStatus": "Clean"
  },
  "system": {
    "id": "system:opnsense",
    "classification": "CONFIRMED",
    "evidence": [
      {
        "sourceType": "opnsense-config",
        "sourceId": "config.sanitized.xml",
        "path": "/opnsense/system",
        "sourceSha256": "0000000000000000000000000000000000000000000000000000000000000000",
        "note": null
      }
    ],
    "hostname": "fw-example",
    "domain": "example.internal",
    "timezone": "Europe/Berlin"
  },
  "interfaces": [],
  "networks": [],
  "vlans": [],
  "dhcp": {"services": [], "scopes": [], "reservations": []},
  "assets": [],
  "dns": {"systemServers": [], "unboundEnabled": null, "forwardingEnabled": null, "dnsblEnabled": null, "safeSearchEnabled": null, "forwards": []},
  "aliases": [],
  "gateways": [],
  "routes": [],
  "vpn": [],
  "nat": [],
  "firewallRules": [],
  "services": [],
  "monitoring": [],
  "cronJobs": [],
  "certificates": [],
  "businessFlows": [],
  "findings": [],
  "unresolvedReferences": []
}
